{"domainName": "141.202.225.1", "parseCode": 8, "audit": {"createdDate": "2023-01-29 16:51:35 UTC", "updatedDate": "2023-01-29 16:51:35 UTC"}, "registrarName": "ARIN", "registrarIANAID": "778", "registryData": {"createdDate": "1994-06-17", "updatedDate": "2021-12-14", "registrant": {"organization": "CA, Inc.", "street1": "One CA Plaza", "city": "Islandia", "state": "NY", "postalCode": "11749", "country": "UNITED STATES", "countryCode": "US", "rawText": "OrgName:        CA, Inc.\nOrgId:          CAINC-12\nAddress:        One CA Plaza\nCity:           Islandia\nStateProv:      NY\nPostalCode:     11749\nCountry:        US\n"}, "administrativeContact": {"organization": "Computer Associates Intl, Inc", "email": "arin-tech@ca.com", "telephone": "18885744357"}, "technicalContact": {"organization": "Computer Associates Intl, Inc", "email": "arin-tech@ca.com", "telephone": "18885744357"}, "domainName": "141.202.225.1", "rawText": "#\n# ARIN WHOIS data and services are subject to the Terms of Use\n# available at: https://www.arin.net/resources/registry/whois/tou/\n#\n# If you see inaccuracies in the results, please report at\n# https://www.arin.net/resources/registry/whois/inaccuracy_reporting/\n#\n# Copyright 1997-2023, American Registry for Internet Numbers, Ltd.\n#\n\n\nNetRange:       141.202.0.0 - 141.202.255.255\nCIDR:           141.202.0.0/16\nNetName:        CA-INTL\nNetHandle:      NET-141-202-0-0-1\nParent:         RIPE-ERX-141 (NET-141-0-0-0-0)\nNetType:        Direct Allocation\nOriginAS:       \nOrganization:   CA, Inc. (CAINC-12)\nRegDate:        1994-06-17\nUpdated:        2021-12-14\nRef:            https://rdap.arin.net/registry/ip/141.202.0.0\n\n\nOrgName:        CA, Inc.\nOrgId:          CAINC-12\nAddress:        One CA Plaza\nCity:           Islandia\nStateProv:      NY\nPostalCode:     11749\nCountry:        US\nRegDate:        2014-07-18\nUpdated:        2014-07-18\nRef:            https://rdap.arin.net/registry/entity/CAINC-12\n\n\nOrgTechHandle: ZC131-ARIN\nOrgTechName:   Computer Associates Intl, Inc\nOrgTechPhone:  +1-888-574-4357 \nOrgTechEmail:  arin-tech@ca.com\nOrgTechRef:    https://rdap.arin.net/registry/entity/ZC131-ARIN\n\nOrgAbuseHandle: ZC131-ARIN\nOrgAbuseName:   Computer Associates Intl, Inc\nOrgAbusePhone:  +1-888-574-4357 \nOrgAbuseEmail:  arin-tech@ca.com\nOrgAbuseRef:    https://rdap.arin.net/registry/entity/ZC131-ARIN\n\n\n#\n# ARIN WHOIS data and services are subject to the Terms of Use\n# available at: https://www.arin.net/resources/registry/whois/tou/\n#\n# If you see inaccuracies in the results, please report at\n# https://www.arin.net/resources/registry/whois/inaccuracy_reporting/\n#\n# Copyright 1997-2023, American Registry for Internet Numbers, Ltd.\n#", "parseCode": 1065, "header": "#\n# ARIN WHOIS data and services are subject to the Terms of Use\n# available at: https://www.arin.net/resources/registry/whois/tou/\n#\n# If you see inaccuracies in the results, please report at\n# https://www.arin.net/resources/registry/whois/inaccuracy_reporting/\n#\n# Copyright 1997-2023, American Registry for Internet Numbers, Ltd.\n#\n", "strippedText": "NetRange:       141.202.0.0 - 141.202.255.255\nCIDR:           141.202.0.0/16\nNetName:        CA-INTL\nNetHandle:      NET-141-202-0-0-1\nParent:         RIPE-ERX-141 (NET-141-0-0-0-0)\nNetType:        Direct Allocation\nOriginAS:\nOrganization:   CA, Inc. (CAINC-12)\nRegDate:        1994-06-17\nUpdated:        2021-12-14\nRef:            https://rdap.arin.net/registry/ip/141.202.0.0\nOrgName:        CA, Inc.\nOrgId:          CAINC-12\nAddress:        One CA Plaza\nCity:           Islandia\nStateProv:      NY\nPostalCode:     11749\nCountry:        US\nRegDate:        2014-07-18\nUpdated:        2014-07-18\nRef:            https://rdap.arin.net/registry/entity/CAINC-12\nOrgTechHandle: ZC131-ARIN\nOrgTechName:   Computer Associates Intl, Inc\nOrgTechPhone:  +1-888-574-4357\nOrgTechEmail:  arin-tech@ca.com\nOrgTechRef:    https://rdap.arin.net/registry/entity/ZC131-ARIN\nOrgAbuseHandle: ZC131-ARIN\nOrgAbuseName:   Computer Associates Intl, Inc\nOrgAbusePhone:  +1-888-574-4357\nOrgAbuseEmail:  arin-tech@ca.com\nOrgAbuseRef:    https://rdap.arin.net/registry/entity/ZC131-ARIN\n#\n# ARIN WHOIS data and services are subject to the Terms of Use\n# available at: https://www.arin.net/resources/registry/whois/tou/\n#\n# If you see inaccuracies in the results, please report at\n# https://www.arin.net/resources/registry/whois/inaccuracy_reporting/\n#\n# Copyright 1997-2023, American Registry for Internet Numbers, Ltd.\n#\n", "audit": {"createdDate": "2023-01-29 16:51:35 UTC", "updatedDate": "2023-01-29 16:51:35 UTC"}, "customField1Name": "netRange", "customField1Value": "141.202.0.0 - 141.202.255.255", "registrarName": "ARIN", "registrarIANAID": "778", "createdDateNormalized": "1994-06-17 00:00:00 UTC", "updatedDateNormalized": "2021-12-14 00:00:00 UTC", "customField2Name": "netName", "customField2Value": "CA-INTL"}, "contactEmail": "arin-tech@ca.com", "estimatedDomainAge": 10453}