{"domainName": "233.43.52.142", "parseCode": 8, "audit": {"createdDate": "2023-01-29 16:51:42 UTC", "updatedDate": "2023-01-29 16:51:42 UTC"}, "registrarName": "ARIN", "registrarIANAID": "778", "registryData": {"createdDate": "1991-05-22", "updatedDate": "2013-08-30", "registrant": {"organization": "Internet Assigned Numbers Authority", "street1": "12025 Waterfront Drive", "street2": "Suite 300", "city": "Los Angeles", "state": "CA", "postalCode": "90292", "country": "UNITED STATES", "countryCode": "US", "rawText": "OrgName:        Internet Assigned Numbers Authority\nOrgId:          IANA\nAddress:        12025 Waterfront Drive\nAddress:        Suite 300\nCity:           Los Angeles\nStateProv:      CA\nPostalCode:     90292\nCountry:        US\n"}, "administrativeContact": {"organization": "ICANN", "email": "abuse@iana.org", "telephone": "13103015820"}, "technicalContact": {"organization": "ICANN", "email": "abuse@iana.org", "telephone": "13103015820"}, "domainName": "233.43.52.142", "rawText": "#\n# ARIN WHOIS data and services are subject to the Terms of Use\n# available at: https://www.arin.net/resources/registry/whois/tou/\n#\n# If you see inaccuracies in the results, please report at\n# https://www.arin.net/resources/registry/whois/inaccuracy_reporting/\n#\n# Copyright 1997-2023, American Registry for Internet Numbers, Ltd.\n#\n\n\nNetRange:       224.0.0.0 - 239.255.255.255\nCIDR:           224.0.0.0/4\nNetName:        MCAST-NET\nNetHandle:      NET-224-0-0-0-1\nParent:          ()\nNetType:        IANA Special Use\nOriginAS:       \nOrganization:   Internet Assigned Numbers Authority (IANA)\nRegDate:        1991-05-22\nUpdated:        2013-08-30\nComment:        Addresses starting with a number between 224 and 239 are used for IP multicast.  IP multicast is a technology for efficiently sending the same content to multiple destinations.  It is commonly used for distributing financial information and video streams, among other things.\nComment:        \nComment:        A full list of IPv4 multicast assignments can be found at:\nComment:        \nComment:        http://www.iana.org/assignments/multicast-addresses\nComment:        \nComment:        A document describing the policies for assigning multicast addresses can be found at:\nComment:        http://datatracker.ietf.org/doc/rfc5771\nRef:            https://rdap.arin.net/registry/ip/224.0.0.0\n\n\n\nOrgName:        Internet Assigned Numbers Authority\nOrgId:          IANA\nAddress:        12025 Waterfront Drive\nAddress:        Suite 300\nCity:           Los Angeles\nStateProv:      CA\nPostalCode:     90292\nCountry:        US\nRegDate:        \nUpdated:        2012-08-31\nRef:            https://rdap.arin.net/registry/entity/IANA\n\n\nOrgAbuseHandle: IANA-IP-ARIN\nOrgAbuseName:   ICANN\nOrgAbusePhone:  +1-310-301-5820 \nOrgAbuseEmail:  abuse@iana.org\nOrgAbuseRef:    https://rdap.arin.net/registry/entity/IANA-IP-ARIN\n\nOrgTechHandle: IANA-IP-ARIN\nOrgTechName:   ICANN\nOrgTechPhone:  +1-310-301-5820 \nOrgTechEmail:  abuse@iana.org\nOrgTechRef:    https://rdap.arin.net/registry/entity/IANA-IP-ARIN\n\n\n#\n# ARIN WHOIS data and services are subject to the Terms of Use\n# available at: https://www.arin.net/resources/registry/whois/tou/\n#\n# If you see inaccuracies in the results, please report at\n# https://www.arin.net/resources/registry/whois/inaccuracy_reporting/\n#\n# Copyright 1997-2023, American Registry for Internet Numbers, Ltd.\n#", "parseCode": 1065, "header": "#\n# ARIN WHOIS data and services are subject to the Terms of Use\n# available at: https://www.arin.net/resources/registry/whois/tou/\n#\n# If you see inaccuracies in the results, please report at\n# https://www.arin.net/resources/registry/whois/inaccuracy_reporting/\n#\n# Copyright 1997-2023, American Registry for Internet Numbers, Ltd.\n#\n", "strippedText": "NetRange:       224.0.0.0 - 239.255.255.255\nCIDR:           224.0.0.0/4\nNetName:        MCAST-NET\nNetHandle:      NET-224-0-0-0-1\nParent:          ()\nNetType:        IANA Special Use\nOriginAS:\nOrganization:   Internet Assigned Numbers Authority (IANA)\nRegDate:        1991-05-22\nUpdated:        2013-08-30\nComment:        Addresses starting with a number between 224 and 239 are used for IP multicast.  IP multicast is a technology for efficiently sending the same content to multiple destinations.  It is commonly used for distributing financial information and video streams, among other things.\nComment:\nComment:        A full list of IPv4 multicast assignments can be found at:\nComment:\nComment:        http://www.iana.org/assignments/multicast-addresses\nComment:\nComment:        A document describing the policies for assigning multicast addresses can be found at:\nComment:        http://datatracker.ietf.org/doc/rfc5771\nRef:            https://rdap.arin.net/registry/ip/224.0.0.0\nOrgName:        Internet Assigned Numbers Authority\nOrgId:          IANA\nAddress:        12025 Waterfront Drive\nAddress:        Suite 300\nCity:           Los Angeles\nStateProv:      CA\nPostalCode:     90292\nCountry:        US\nRegDate:\nUpdated:        2012-08-31\nRef:            https://rdap.arin.net/registry/entity/IANA\nOrgAbuseHandle: IANA-IP-ARIN\nOrgAbuseName:   ICANN\nOrgAbusePhone:  +1-310-301-5820\nOrgAbuseEmail:  abuse@iana.org\nOrgAbuseRef:    https://rdap.arin.net/registry/entity/IANA-IP-ARIN\nOrgTechHandle: IANA-IP-ARIN\nOrgTechName:   ICANN\nOrgTechPhone:  +1-310-301-5820\nOrgTechEmail:  abuse@iana.org\nOrgTechRef:    https://rdap.arin.net/registry/entity/IANA-IP-ARIN\n#\n# ARIN WHOIS data and services are subject to the Terms of Use\n# available at: https://www.arin.net/resources/registry/whois/tou/\n#\n# If you see inaccuracies in the results, please report at\n# https://www.arin.net/resources/registry/whois/inaccuracy_reporting/\n#\n# Copyright 1997-2023, American Registry for Internet Numbers, Ltd.\n#\n", "audit": {"createdDate": "2023-01-29 16:51:42 UTC", "updatedDate": "2023-01-29 16:51:42 UTC"}, "customField1Name": "netRange", "customField1Value": "224.0.0.0 - 239.255.255.255", "registrarName": "ARIN", "registrarIANAID": "778", "createdDateNormalized": "1991-05-22 00:00:00 UTC", "updatedDateNormalized": "2013-08-30 00:00:00 UTC", "customField2Name": "netName", "customField2Value": "MCAST-NET"}, "contactEmail": "abuse@iana.org", "domainNameExt": ".142", "estimatedDomainAge": 11575}